{
  "id": "p_early_02",
  "name": "하린",
  "age": 26,
  "gender": "female",
  "segment": "early",
  "background": "프리랜서 그래픽 디자이너",
  "occupation": "Graphic Designer",
  "location": "San Francisco, US",
  "household_size": 2,
  "income_monthly": 3400000,
  "spend_monthly": 2200000,
  "spend_breakdown": {"housing": 800000, "food": 500000, "transport": 180000, "subscription": 120000, "leisure": 300000},
  "traits": {"tech_savvy": "high", "patience": "low"},
  "goals": ["버전 관리와 피드백 통합", "다양한 해상도/포맷 일괄 내보내기", "브랜드 컬러/컴포넌트 일관성 유지"],
  "pains": ["내보내기 옵션이 분산되어 있음", "미리보기 속도 느림", "가이드 문서와 실제 UI 불일치"]
}

