{
  "id": "p_early_04",
  "name": "시온",
  "age": 28,
  "gender": "nonbinary",
  "segment": "early",
  "background": "크리에이터 & 커뮤니티 매니저",
  "occupation": "Community Manager",
  "location": "Incheon, KR",
  "household_size": 2,
  "income_monthly": 3000000,
  "spend_monthly": 2100000,
  "spend_breakdown": {"housing": 750000, "food": 520000, "transport": 160000, "subscription": 130000, "leisure": 260000},
  "traits": {"tech_savvy": "medium", "patience": "high"},
  "goals": ["커뮤니티 참여 추세와 핵심 기여자 파악", "캠페인/공지 템플릿으로 빠른 실행", "부정행위/스팸 탐지 자동화"],
  "pains": ["용어와 지표 정의가 불명확", "헬프센터 검색 정확도 낮음", "권한 위임 흐름이 복잡"]
}

